{
  "contract_version": "cwl_cefr_language_assessment/task_specification/v1",
  "task_reference": "reading_task_001",
  "task_revision_reference": "reading_task_001_revision_01",
  "assessment_blueprint_reference": "cefr_en_placement_a1_b2_blueprint_v1",
  "descriptor_source_policy_code": "reference_only_no_descriptor_copy",
  "target_language": "en",
  "communication_mode_code": "reception",
  "activity_domain_code": "reading_reception",
  "use_domain_code": "professional",
  "response_mode_code": "selected_response",
  "descriptor_references": ["coe_descriptor_reference_opaque_001"],
  "target_level_codes": ["b1", "b2"],
  "source_content_release_reference": "content_release_reading_001",
  "accessibility_profile_reference": "accessibility_profile_reading_v1",
  "rights_reference": "rights_record_reading_001",
  "linguistic_demand_reference": "linguistic_demand_reading_001",
  "cognitive_demand_reference": "cognitive_demand_reading_001",
  "evidence_model_reference": "evidence_model_reading_selected_response_v1",
  "task_content_digest": "sha256:1111111111111111111111111111111111111111111111111111111111111111"
}
